,AbilityResourceMax,AbilityResourceRegenPerSecond,BaseHealthRegen,BoundAbilities,BulletDamage,BulletGravityScale,BulletRadius,BulletSpeed,ClipSize,CritDamageReceivedScale,CrouchSpeed,DPS,FalloffBias,FalloffEndRange,FalloffEndScale,FalloffStartRange,FalloffStartScale,HeavyMeleeDamage,LevelScaling,LightMeleeDamage,MaxHealth,MaxMoveSpeed,MoveAcceleration,Name,ProcBuildUpRateScale,ReloadDelay,ReloadMovespeed,ReloadSingle,ReloadSpeed,ReloadTime,RoundsPerSecond,SpiritScaling,SprintSpeed,Stamina,StaminaCooldown,StaminaRegenPerSecond,TechDuration,TechRange,WeaponPower,WeaponPowerScale,BulletArmorDamageReduction,TechArmorDamageReduction
hero_rutger,0,0,2.0,"{'1': {'AbilityCharges': 1, 'AbilityCooldown': 17, 'AbilityCooldownBetweenCharge': 1, 'AbilityUnitTargetLimit': 1, 'AirSpeedMax': 150, 'BossDamagePercent': 100, 'CameraHeightOffset': 20, 'CameraHorizontalOffset': 15, 'ChannelMoveSpeed': 50, 'Damage': 120, 'Description': ""Launch a rocket that deals damage in an area and applies knockback.<br>Rutger receives 50% damage and 175% knockback from his own rocket if he's in its impact radius."", 'FallSpeedMax': 60, 'ImpactRadius': '5m', 'LaunchMaxSpeed': 600, 'LaunchMinSpeed': 525, 'LaunchMinVerticalAmount': 0.2, 'LaunchVerticalBias': 0.75, 'Name': 'Rocket Launcher', 'SelfDamagePercent': 50, 'SelfLaunchPercent': 175, 'TechCleaveExpireTime': 0.2}, '2': {'AbilityCastDelay': 0.1, 'AbilityCooldown': 42, 'AbilityDuration': 10, 'AbilityUnitTargetLimit': 1, 'ChannelMoveSpeed': 50, 'ChargeUpTime': 0.5, 'Damage': 70, 'Description': 'Create a field at target location that pushes enemies away from its outer edge.', 'EdgePushDuration': 0.15, 'ForceFieldThinkRate': 0.05, 'Height': 150, 'Name': 'Force Field', 'SlowDuration': 0.30000000000000004, 'SlowPercent': 60, 'SpherePushExtraDistance': '1.5m', 'SphereRadius': '5m', 'VictimPushTime': 0.4}, '3': {'AbilityCooldown': 42, 'AbilityDuration': 4, 'AbilityUnitTargetLimit': 1, 'BonusHealthRegen': 2, 'ChannelMoveSpeed': 50, 'Description': 'When taking otherwise fatal damage, Rutger becomes unkillable for 4s.', 'Name': 'Cheat Death'}, '4': {'AbilityCooldown': 127, 'AbilityDuration': 6, 'AbilityUnitTargetLimit': 1, 'ChannelMoveSpeed': 50, 'DamageMax': 350, 'DamageMax_DistanceFuzz': '2m', 'DamageMin': 50, 'Description': 'Release a fast pulse in a large area that damages, slows, and prevents enemies from using abilities.<br>The damage dealt is based on how close the enemy is to the center of the pulse.', 'EndRadius': '30m', 'MovementSlow': 25, 'Name': 'Pulse', 'SpreadDuration': 0.6000000000000001, 'StartRadius': '1m'}}",3.24,0.8,0,320,14,0.0,4.75,18.0,0.5,58,0.1,22,1,116,"{'BulletDamage': 0.0, 'MeleeDamage': 3.4, 'Health': 41.0, 'TechDamagePerc': 0.0, 'BulletResist': 0.0}",63,550,7.0,4,Rutger,1,0.0,1,False,1,2.4,5.5600000000000005,{},0,3,5,0.2,0,0,0,1,,
hero_shiv,0,0,2.0,"{'1': {'AOERadius': '10m', 'AbilityChannelTime': 0.2, 'AbilityCharges': 2, 'AbilityCooldown': 19, 'AbilityCooldownBetweenCharge': 2, 'AbilityPostCastDuration': 0.30000000000000004, 'AbilityUnitTargetLimit': 1, 'BleedDPSPerStack': 5, 'BleedDuration': 5, 'BleedTickRate': 1, 'ChannelMoveSpeed': 50, 'Description': 'Throw a knife that damages and bleeds an enemy.  Each additional hit adds a stack and refreshes the bleed duration, causing the bleed to increase per stack.', 'ImpactDamage': 35, 'MovementSlow': 35, 'Name': 'Serrated Knives', 'RicochetCount': 1}, '2': {'AbilityCastDelay': 0.25, 'AbilityCooldown': 16, 'AbilityPostCastDuration': 0.2, 'AbilityUnitTargetLimit': 1, 'CameraDistance': 250, 'ChannelMoveSpeed': 50, 'DashAngleThreshold': 89, 'DashRadius': '2.5m', 'DashRange': '12m', 'DashSpeed': 2400, 'Description': 'Perform a dash forward, damaging enemies along the path.<br><br>Ultimate Unlock: While rage is full an echo of Shiv retraces the dash path after a short delay, damaging enemies again.', 'ImpactDamage': 105, 'MoveSpeedPenaltyMaxSpeed': 200, 'Name': 'Slice and Dice', 'SideMoveSpeedReduction': -100, 'TechCleaveExpireTime': 0.35000000000000003}, '3': {'AbilityCastDelay': 0.25, 'AbilityCooldown': 21, 'AbilityUnitTargetLimit': 1, 'ChannelMoveSpeed': 50, 'DamagePctDeferred': 30, 'DamagePctDeferredMaxRage': 15, 'DeferClearPct': 40, 'DeferredDamageDuration': 10, 'Description': 'Take only a portion of incoming damage immediately and defer the rest to be taken over time.  Activate to clear a portion of the deferred damage.', 'Name': 'Bloodletting'}, '4': {'AbilityCastRange': '20m', 'AbilityCooldown': 95, 'AbilityPostCastDuration': 0.25, 'AbilityUnitTargetLimit': 1, 'BonusAbilityResource': 10, 'BuffDamage': 20, 'CameraDistance': 400, 'ChannelMoveSpeed': 50, 'Damage': 200, 'Description': None, 'EnemyHealthPercent': 20, 'EnemyHealthPercentBuffer': 3, 'JumpHeight': 80, 'MinTimeToTarget': 0.5, 'MoveSpeedToTarget': '25m', 'Name': 'Killing Blow', 'NonPlayerRageScale': 0.2, 'PauseOnTargetTime': 0.66, 'RageDrainDelayDuration': 7, 'RageDrainRate': 0.30000000000000004, 'RagePerHeavyMelee': 3.5, 'RagePerLightMelee': 1.5, 'RagePerSpiritDamage': 0.02, 'RagePerWeaponDamage': 0.015, 'SlashRange': 80}}",5.7,0.8,0,610,10,0.0,4.75,10.9,0.5,41,0.1,20,1,116,"{'BulletDamage': 0.4, 'MeleeDamage': 3.4, 'Health': 35.0, 'TechDamagePerc': 0.0, 'BulletResist': 0.0}",63,600,7.0,4,Shiv,1,0.0,1,False,1,2.8,1.9,{},0,3,5,0.2,0,0,0,1,,
hero_slork,0,0,2.0,"{'1': {'AbilityCastDelay': 0.2, 'AbilityCooldown': 25, 'AbilityDuration': 3, 'AbilityUnitTargetLimit': 1, 'BurnDuration': 2, 'ChannelMoveSpeed': 50, 'ClimbHeight': '1m', 'DPS': 24, 'Description': 'Summon a churning vortex of superheated water that burns enemies and lauches them towards Slork.', 'DistanceAboveGround': '0.25m', 'DropDownRate': 2, 'ImpactDamage': 32, 'Name': 'Riptide', 'OpenHeight': '2m', 'Radius': '3.5m', 'Speed': 600, 'TickRate': 0.5, 'TossSpeed': 650}, '2': {'AbilityCastRange': '10m', 'AbilityCooldown': 35, 'AbilityDuration': 2.5, 'AbilityUnitTargetLimit': 1, 'BreakRange': '6m', 'ChannelMoveSpeed': 50, 'CooldownOnMiss': 5.25, 'DPS': 24, 'DamagePercentHealth': 4, 'Description': 'Dash forward and grab onto an enemy, biting them repeatedly. The enemy is slowed, disarmed, and silenced while grappled. When the target is below half health, deal an additional 4% of their max health in damage.', 'FollowDampingFactor': 5, 'HobbledMovementSlow': 15, 'LiftHeight': 30, 'LiftHorizontal': -70, 'Name': 'Chomp', 'TickRate': 0.5}, '3': {'AbilityCooldown': 29, 'AbilityDuration': 8, 'AbilityUnitTargetLimit': 1, 'BlastRadius': '8m', 'BurstDamage': 80, 'ChannelMoveSpeed': 50, 'DamageAbsorb': 120, 'Description': 'Encase yourself in a sphere of water that can absorb up to 120 damage before bursting. When the sphere disipates for any reason enemies in range take 80 damage.', 'Name': ""Deep's Embrace""}, '4': {'AbilityCastRange': '20m', 'AbilityCharges': 1, 'AbilityChargesConditionally': 1, 'AbilityUnitTargetLimit': 100, 'AmbushDamage': 80, 'AmbushTime': 0.25, 'CantHideTime': 5, 'ChannelMoveSpeed': 50, 'Description': 'Fade from view when not shooting or using abilities. When fully invisible, can be cast to deal 80 damage and +2 stamina damage to enemies in front of Slork.', 'FullInvisDistance': '50m', 'InvisFadeToDuration': 10, 'InvisMoveSpeedMod': '2.0m', 'Name': 'Ambush Predator', 'PreventHealingTime': 7, 'RevealOnDamageDuration': 5, 'RevealOnSpottedDuration': 5, 'SpottedRadius': '16m', 'StaminaDamage': 2}}",11.0,0.30000000000000004,0,231,20,0.0,4.75,55.0,0.5,58,0.1,22,1,116,"{'BulletDamage': 0.73, 'MeleeDamage': 3.4, 'Health': 41.0, 'TechDamagePerc': 0.0, 'BulletResist': 0.0}",63,550,7.0,4,Fathom,1,0.0,1,False,1,2.2,5.0,{},0,3,5,0.2,0,0,0,1,,
hero_synth,0,0,2.0,"{'1': {'AbilityCastDelay': 0.30000000000000004, 'AbilityChannelTime': 2, 'AbilityCooldown': 32, 'AbilityUnitTargetLimit': 1, 'AirDrag': 0.30000000000000004, 'AirSpeedMax': 100, 'AmpDuration': 15, 'AmpPercentPerStack': 6, 'ChannelMoveSpeed': 50, 'DamagePerProjectile': 35, 'Description': ""Channel to start launching projectiles that deal damage and apply movement slow around their impact point. Each projectile landed on a hero grants you a stacking buff that amplifies all of your damage.<br>If you cast it while in the air, you'll float and maintain any horizontal momentum you started with."", 'FallSpeedMax': 10, 'MoveSlowPercent': 30, 'Name': 'Barrage', 'ProjectileAmount': 4, 'Radius': '6.5m', 'SlowDuration': 1.5}, '2': {'AbilityCastDelay': 0.2, 'AbilityCooldown': 32, 'AbilityUnitTargetLimit': 1, 'ChannelMoveSpeed': 50, 'Damage': 90, 'Description': 'Launch a sentient cloak that travels forward and damages enemies. You can press [] to teleport to its location.', 'MaxLifetime': 3.2, 'Name': 'Flying Cloak', 'Radius': '5m', 'TickRate': 0.1}, '3': {'AbilityCastDelay': 0.15, 'AbilityChannelTime': 2, 'AbilityCooldown': 17, 'AbilityUnitTargetLimit': 1, 'ChannelMoveSpeed': 50, 'Damage': 100, 'Description': 'Escape into your suitcase. When the duration ends, deal damage to nearby enemies. Duration can be ended early by performing any action.', 'FallSpeedMax': 1, 'Name': ""Enchanter's Satchel"", 'Radius': '12m'}, '4': {'AbilityCastDelay': 0.6000000000000001, 'AbilityCooldown': 127, 'AbilityUnitTargetLimit': 1, 'CanBePurged': 1, 'ChannelMoveSpeed': 50, 'DPS': 23, 'DamageInterval': 0.5, 'DebuffDuration': 18, 'Description': ""Apply damage over time to all enemies nearby.<br>Affliction's damage is non-lethal and does not apply item procs."", 'Name': 'Affliction', 'Radius': '14m'}}",5.0,0.8,0,559,11,0.0,4.75,10.0,0.5,46,0.1,22,1,116,"{'BulletDamage': 0.4, 'MeleeDamage': 3.4, 'Health': 31.0, 'TechDamagePerc': 0.0, 'BulletResist': 0.0}",63,550,7.0,4,Pocket,1,0.0,1,False,1,2.8200000000000003,2.0,{},0,3,5,0.2,0,0,0,1,,-15.0
hero_targetdummy,0,0,2.0,"{'1': {'AbilityCastDelay': 1, 'AbilityCooldown': 10.5, 'AbilityUnitTargetLimit': 1, 'ChannelMoveSpeed': 50, 'Description': None, 'Name': None}, '2': {'AbilityCastDelay': 1, 'AbilityCooldown': 10.5, 'AbilityUnitTargetLimit': 1, 'ChannelMoveSpeed': 50, 'Description': None, 'Name': None}, '3': {'AbilityCastDelay': 1, 'AbilityCooldown': 10.5, 'AbilityUnitTargetLimit': 1, 'ChannelMoveSpeed': 50, 'Description': None, 'Name': None}, '4': {'AbilityCastDelay': 1, 'AbilityCooldown': 10.5, 'AbilityUnitTargetLimit': 1, 'ChannelMoveSpeed': 50, 'Description': None, 'Name': None}}",11.6,0.0,0,635,15,0.0,4.75,58.0,0.5,58,0.1,22,1,116,"{'BulletDamage': 0.0, 'MeleeDamage': 3.4, 'Health': 41.0, 'TechDamagePerc': 0.0, 'BulletResist': 0.0}",63,3000,7.0,4,TargetDummy,1,0.0,1,False,1,2.0,5.0,{},0,3,5,0.2,0,0,0,1,,
hero_tengu,0,0,2.0,"{'1': {'AbilityCastDelay': 0.2, 'AbilityCharges': 1, 'AbilityCooldown': 32, 'AbilityCooldownBetweenCharge': 8, 'AbilityDuration': 4, 'AbilityUnitTargetLimit': 1, 'BossDamagePercent': 50, 'ChannelMoveSpeed': 50, 'DPS': 60, 'Description': 'Summon a patch of choking vines that damages and slows enemies in its radius.', 'Height': '3m', 'Name': 'Kudzu Bomb', 'Radius': '6m', 'SlowPercent': 35, 'TickRate': 0.25}, '2': {'AbilityCastRange': '16m', 'AbilityCooldown': 37, 'AbilityDuration': 12, 'AbilityUnitTargetLimit': 1, 'BonusFireRate': 10, 'BulletLifestealPercent': 15, 'ChannelMoveSpeed': 50, 'Description': 'Gain bonuses and automatically connect with a nearby ally to share them.  Healing is replicated among all those connected. Connection requires line of sight. Press [] to Lock on to a target', 'HealingPerGlub': 20, 'MoveSpeedBonus': '0m', 'Name': ""Watcher's Covenant"", 'TetherSharedHealPct': 30, 'TickRate': 0.1, 'TotalTetherTargets': 1}, '3': {'AbilityCastDelay': 0.25, 'AbilityCooldown': 42, 'AbilityDuration': 2, 'AbilityUnitTargetLimit': 1, 'ChannelMoveSpeed': 50, 'Damage': 80, 'DampingFactor': 0.25, 'Description': 'Turn yourself into impervious stone and smash into the ground, stunning and damaging enemies nearby. Heals you for a percentage of your max health. You have some air control before falling.', 'LiftHeight': 180, 'LiftTime': 1, 'MaxHealthRegen': 10, 'MoveSpeedMax': '8m', 'Name': 'Stone Form', 'Radius': '6m', 'StatueScale': 1, 'StunDuration': 0.75}, '4': {'AbilityCastDelay': 1.3, 'AbilityCastRange': '8m', 'AbilityCooldown': 85, 'AbilityDuration': 17, 'AbilityUnitTargetLimit': 1, 'AirDropBulletShield': 200, 'AllyCastDelay': 0.2, 'AllyOutgoingDamagePercent': -50, 'BuffDuration': 12, 'ChannelMoveSpeed': 50, 'DebuffDuration': 4, 'Description': 'Take flight with an ally or a bomb. Drop your ally or bomb to cause a large explosion that causes movement slow.  and ally gain a bullet shield when flying ends. <br>While lifted, your ally gains bullet resist but cannot attack and deals -50% damage. Air Drop has faster cast time when targeting an ally. <br>[] to accelerate flying speed. <br>[] to drop ally/bomb.', 'ExplodeDamage': 150, 'FlyingBulletResist': 40, 'Name': 'Air Drop', 'OnLandDamageRadius': '14m', 'OnLandDamageRadiusStart': '4m', 'SilenceBombSpeed': '12m', 'SlowPercent': 35, 'TossSpeed': 400}}",4.5,0.8,0,572,33,0.0,4.75,64.3,0.5,58,0.1,22,1,116,"{'BulletDamage': 0.5, 'MeleeDamage': 3.4, 'Health': 35.0, 'TechDamagePerc': 0.0, 'BulletResist': 0.0}",63,550,7.0,4,Ivy,1,0.0,1,False,1,2.44,14.3,{},0,4,5,0.2,0,0,0,1,,
hero_thumper,0,0,2.0,"{'1': {'AbilityCastDelay': 0.1, 'AbilityCastRange': '40m', 'AbilityCharges': 1, 'AbilityCooldown': 17, 'AbilityCooldownBetweenCharge': 4, 'AbilityUnitTargetLimit': 1, 'BounceRadians': 0.5, 'BounceRange': '20m', 'ChannelMoveSpeed': 50, 'Damage': 120, 'Description': 'Thumper focuses a high power acoustic wave to reflect off of a hard surface. Blasting shards of material off in the reflected wave.', 'MaxPlaneDistance': '1m', 'Name': 'Shatter Cannon', 'PlaneSpread': 30, 'PushSpeedMax': 1000, 'PushSpeedMid': 600, 'PushSpeedMin': 100}, '2': {'AbilityCastDelay': 0.42, 'AbilityCooldown': 26, 'AbilityDuration': 6, 'AbilityUnitTargetLimit': 1, 'BarbedWireDPS': 10, 'BarbedWireDamagePerMeter': 30, 'BarbedWireHeightOffGround': '1m', 'BarbedWireRadius': '4m', 'BarbedWireSlow': 50, 'BarbedWireTickRate': 0.5, 'ChannelMoveSpeed': 50, 'Damage': 125, 'Description': 'Rolls out a spike strip that damage enemies more the further they move through it.', 'ImpactInterval': 0.1, 'Name': 'Spike Strip', 'StompRange': '25m', 'TechCleaveExpireTime': 0.2, 'VerticalDifferenceTolerance': '2.5m'}, '3': {'AbilityCastDelay': 0.2, 'AbilityCastRange': '30m', 'AbilityCooldown': 42, 'AbilityDuration': 8, 'AbilityUnitTargetLimit': 1, 'ChannelMoveSpeed': 50, 'DPS': 8, 'Description': ""Sends out a badger drone to harry an enemy and reveal it's position."", 'Name': 'Badger Drone', 'TickInterval': 0.5, 'VisibilityTime': 0.2}, '4': {'AbilityCooldown': 10.5, 'AbilityUnitTargetLimit': 1, 'ChannelMoveSpeed': 50, 'ClimbHeight': '1m', 'Description': 'Blow enemies away with a high powered blast of air.', 'DistanceAboveGround': '2m', 'DropDownRate': 2, 'Duration': 4, 'InitialForce': 300, 'Name': 'Vortex', 'PushAccel': 1000, 'PushNPCSpeed': 800, 'Radius': '15m', 'TornadoSpeed': 350}}",34.2,0.25,0,124,6,0.0,4.75,57.0,0.5,58,0.1,22,1,116,"{'BulletDamage': 0.0, 'MeleeDamage': 3.4, 'Health': 41.0, 'TechDamagePerc': 0.0, 'BulletResist': 0.0}",63,550,7.0,4,Thumper,1,0.0,1,False,1,2.1,1.67,{},0,3,5,0.2,0,0,0,1,,
hero_tokamak,0,0,2.0,"{'1': {'AbilityCastDelay': 0.2, 'AbilityChannelTime': 1, 'AbilityCharges': 2, 'AbilityCooldown': 32, 'AbilityCooldownBetweenCharge': 1, 'AbilityUnitTargetLimit': 1, 'BeamLength': '30m', 'BeamWidth': '4.0m', 'ChannelMoveSpeed': 70, 'Description': 'Blast your enemies with a jet of superheated plasma. Deals additional damage when the heat guage is in the red. Triples heat dissipation while active.', 'HeatPowerLength': '0m', 'HotDPS': 90, 'Name': 'Hot Shot', 'NormalDPS': 55, 'TickRate': 0.1, 'TrackingSpeed': 180}, '2': {'AbilityCastDelay': 0, 'AbilityCastRange': '20m', 'AbilityCooldown': 25, 'AbilityUnitTargetLimit': 1, 'ChannelMoveSpeed': 50, 'Damage': 80, 'Description': 'Launch forward damaging all enemies near where you land, knocking them into the air.', 'ExplosionRadius': '6m', 'GravityScale': 1.4, 'Name': 'Dying Star', 'TossSpeed': 350}, '3': {'AbilityCastDelay': 0.25, 'AbilityCooldown': 48, 'AbilityDuration': 6, 'AbilityUnitTargetLimit': 1, 'BlindScale': 0.5, 'ChannelMoveSpeed': 50, 'Description': 'Bring your core to the brink of criticality, blinding and damaging any that look in your direction. Damage increases when enemies look directly at you.', 'EvasionChance': 20, 'LookDotMin': 0.866, 'LookRadiusScale': '1m', 'MaxDPS': 16, 'Name': 'Blinding Radiance', 'Radius': '40m', 'TickRate': 0.25}, '4': {'AbilityCastDelay': 2, 'AbilityCastRange': '100m', 'AbilityChannelTime': 3.6, 'AbilityCooldown': 127, 'AbilityUnitTargetLimit': 1, 'AimFOV': 60, 'AimZoomDuration': 0.15, 'AirSpeedMax': 70, 'ChannelMoveSpeed': 50, 'Damage': 190, 'DelayBetweenShots': 0.6000000000000001, 'Description': 'Collect targets until ready to unload. Each shot is 0.6s apart.', 'FallSpeedMax': 1, 'Name': 'Pulse Cannon', 'TargetingWidth': '0.8m'}}",8.2,0.8,0,406,50,0.0,4.75,68.3,0.5,58,0.1,22,1,116,"{'BulletDamage': 0.8487, 'MeleeDamage': 3.4, 'Health': 41.0, 'TechDamagePerc': 0.0, 'BulletResist': 0.0}",63,550,7.0,4,Tokamak,1,0.0,1,False,1,4.0,8.33,{},0,3,5,0.2,0,0,0,1,,
hero_viscous,0,0,2.0,"{'1': {'AbilityCastDelay': 0.001, 'AbilityCooldown': 21, 'AbilityPostCastDuration': 0.5, 'AbilityUnitTargetLimit': 1, 'BossDamagePercent': 50, 'ChannelMoveSpeed': 50, 'Damage': 100, 'Description': 'Throw a ball of goo that deals damage and leaves puddles of goo behind that apply movement slow to enemies in the radius.', 'DetonateCooldown': 0.15, 'Name': 'Splatter', 'PuddleDuration': 10, 'Radius': '5m', 'SecondHitDamagePercentage': 0.7000000000000001, 'SlowPercent': 35, 'ThirdHitDamagePercentage': 0.5}, '2': {'AbilityCastDelay': 0.1, 'AbilityCastRange': '30m', 'AbilityCooldown': 48, 'AbilityDuration': 4, 'AbilityUnitTargetLimit': 1, 'BonusHealthRegen': 40, 'BonusMoveSpeed': '0m', 'BreakoutTime': 1, 'BulletForce': 600, 'ChannelMoveSpeed': 50, 'CubeScale': 1.5, 'Description': 'Encase the target in a cube of restorative goo that purges debuffs, protects from damage, and increases health regen. Target is unable to take any new actions while cubed. Can be used on self. Press [] to escape early.', 'Friction': -80, 'HeavyMeleeForce': 700, 'LightMeleeForce': 300, 'Name': 'The Cube', 'PostCubeBuffDuration': 8, 'PushBackForce': 250, 'PushBackRadius': 50, 'SlideForce': 70}, '3': {'AbilityCastRange': '40m', 'AbilityCharges': 1, 'AbilityCooldown': 30, 'AbilityCooldownBetweenCharge': 1.5, 'AbilityUnitTargetLimit': 1, 'ChannelMoveSpeed': 50, 'Description': 'Materialize a fist in the world that punches units in the area and send them flying. Enemies will be dealt damage, have their dash distance reduced for a brief moment, and have their movement slowed. This is considered a Light Melee attack.', 'ImpactDuration': 4, 'Name': 'Puddle Punch', 'PunchHalfHeight': '5.5m', 'PunchRollSlow': -40, 'PunchRollSlowDuration': 1, 'Radius': '4m', 'SlowPercent': 20, 'TossGroundSideRatio': 0.7000000000000001, 'TossSpeed': 625, 'TossSpeedUpWall': 500, 'TossSpeedWall': 750}, '4': {'AbilityCastDelay': 0.55, 'AbilityCooldown': 95, 'AbilityDuration': 10, 'AbilityUnitTargetLimit': 1, 'AccelerationPercentage': -60, 'AirJumpForce': 500, 'BallOffset': 50, 'BallRadius': 63, 'BallScale': 2, 'BossDamagePercent': 50, 'BreakablePropDamageRadius': 75, 'BulletResist': 60, 'ChannelMoveSpeed': 275, 'Damage': 140, 'Description': 'Morph into a large goo ball that deals damage and stuns enemies on impact. The ball grants large amounts of Bullet and Spirit resist, bounces off walls and can double jump.', 'FrictionPercentage': -85, 'JumpForce': 500, 'KnockForce': 400, 'MoveSpeedMax': '7m', 'Name': 'Goo Ball', 'ParticleRadiusMultiplier': 1.2, 'Radius': None, 'StunDuration': 1, 'TechResist': 70, 'TickRate': 0.25}}",13.0,0.0,0,254,20,0.0,4.75,65.0,0.5,58,0.1,22,1,116,"{'BulletDamage': 1.1, 'MeleeDamage': 3.4, 'Health': 38.0, 'TechDamagePerc': 0.0, 'BulletResist': 0.0}",63,550,7.0,4,Viscous,1,0.0,1,False,1,2.5,5.0,{},0,3,5,0.2,0,0,0,1,,
hero_warden,0,0,2.0,"{'1': {'AbilityCastDelay': 0.1, 'AbilityCooldown': 14, 'AbilityUnitTargetLimit': 1, 'ChannelMoveSpeed': 50, 'Damage': 55, 'DebuffDuration': 6, 'Description': 'Throw a flask that damages, slows, and reduces the weapon damage and stamina of enemies it hits.', 'ForwardVelocity': 800, 'MoveSpeedSlowPct': 20, 'Name': 'Alchemical Flask', 'ProjectileLifetime': 60, 'Radius': '6.5m', 'WeaponPowerDebuff': -30}, '2': {'AbilityCooldown': 42, 'AbilityDuration': 7, 'AbilityUnitTargetLimit': 1, 'ChannelMoveSpeed': 50, 'Description': 'Gain a spirit shield and bonus movement speed.', 'MoveSpeedBonusPct': 15, 'Name': 'Willpower', 'TechShieldPoints': 150}, '3': {'AbilityCastDelay': 0.15, 'AbilityCastRange': '20m', 'AbilityCooldown': 37, 'AbilityUnitTargetLimit': 1, 'ChannelMoveSpeed': 50, 'Damage': 120, 'Description': ""Curse an enemy hero. If they don't move away from their initial position within the escape time, they will be damaged and immobilized."", 'EscapeRange': '16m', 'EscapeTime': 2.5, 'ImmobilizeDuration': 1.75, 'Name': 'Binding Word'}, '4': {'AbilityCastDelay': 2.25, 'AbilityCooldown': 138, 'AbilityDuration': 6, 'AbilityUnitTargetLimit': 1, 'BonusMoveSpeed': '0m', 'BulletResist': 50, 'ConeAngle': 115, 'Description': 'After charging for 2.25s, release pulses that damage enemies and heal you based on the damage done. <br>While channeling Last Stand you have greatly increased bullet resist.', 'HealthStealPct': 50, 'HealthStealPctHero': 100, 'Name': 'Last Stand', 'PulseDPS': 100, 'PulseInterval': 0.5, 'Radius': '12m'}}",19.8,0.25,0,213,17,0.0,4.75,79.2,0.5,58,0.1,22,1,116,"{'BulletDamage': 1.2, 'MeleeDamage': 3.4, 'Health': 45.0, 'TechDamagePerc': 0.0, 'BulletResist': 0.0}",63,550,6.0,4,Warden,1,0.0,1,False,1,2.91,4.0,"{'RoundsPerSecond': 0.012, 'FireRate': 0.30000000000000004}",0,3,5,0.2,0,0,0,1,,
hero_wraith,0,0,2.0,"{'1': {'AbilityCastRange': '500m', 'AbilityCharges': 1, 'AbilityChargesConditionally': 1, 'AbilityCooldown': 0.75, 'AbilityPostCastDuration': 0.2, 'AbilityUnitTargetLimit': 1, 'BonusAbilityResource': 100, 'CardResourceGenPctScale': 106, 'CardResourcePerBulletCrit': 6, 'CardResourcePerBulletHit': 4, 'CardResourcePerHeavyMelee': 50, 'CardResourcePerLightMelee': 20, 'ChannelMoveSpeed': 50, 'Damage': 80, 'Description': 'Deal weapon damage to summon cards.  Activate to throw a card that flies towards the enemy or point under your crosshair.', 'Name': 'Card Trick', 'NonPlayerCardResourceScale': 0.35000000000000003, 'ProjectileOriginHeightOffset': 50, 'Radius': '5m', 'ResourcePerCard': 100}, '2': {'AbilityCastDelay': 0.75, 'AbilityCastRange': '25m', 'AbilityCooldown': 48, 'AbilityUnitTargetLimit': 1, 'CameraDistance': 250, 'ChannelMoveSpeed': 200, 'Description': 'Teleport to the targeted location.', 'Name': 'Project Mind', 'TrailInterval': 0.1}, '3': {'AbilityCooldown': 48, 'AbilityDuration': 5, 'AbilityUnitTargetLimit': 1, 'AlliedFireRatePercentage': 50, 'BonusFireRate': 20, 'ChannelMoveSpeed': 50, 'Description': 'Temporarily boosts your fire rate. Nearby allies receive half the fire rate bonus.', 'MagicDamagePerBullet': 0, 'Name': 'Full Auto', 'Radius': '25m'}, '4': {'AbilityCastDelay': 0.6000000000000001, 'AbilityCastRange': '20m', 'AbilityCooldown': 95, 'AbilityDuration': 1.25, 'AbilityUnitTargetLimit': 1, 'ChannelMoveSpeed': 50, 'Damage': 200, 'DampingFactor': 0.5, 'Description': 'Lift an enemy hero into the air, stunning them for a short time. When the lift ends, the target receives Telekinesis damage.', 'LiftHeight': 120, 'Name': 'Telekinesis'}}",5.5,0.0,0,572,52,0.0,4.75,61.1,0.5,58,0.1,22,1,116,"{'BulletDamage': 0.48, 'MeleeDamage': 3.4, 'Health': 31.0, 'TechDamagePerc': 0.0, 'BulletResist': 0.0}",63,550,7.0,4,Wraith,1,0.0,1,False,1,2.8200000000000003,11.1,{'SprintSpeed': 0.06},0,3,5,0.2,0,0,0,1,,
hero_wrecker,0,0,2.0,"{'1': {'AbilityCastDelay': 1.2, 'AbilityCastRange': '50m', 'AbilityCooldown': 21, 'AbilityDuration': 6, 'AbilityUnitTargetLimit': 1, 'ChannelMoveSpeed': 50, 'Description': 'Create a large ball of scrap that can be thrown, damaging and stunning anything it hits. The ball takes time to create and you move slower while carrying it.', 'MinSpeed': 80, 'MoveSpeedLimit': '6m', 'Name': 'Wrecking Ball', 'StunDuration': 1, 'TechCleaveExpireTime': 0.4, 'WreckingBallDamage': 80, 'WreckingBallPushForce': 280}, '2': {'AbilityCastRange': '10m', 'AbilityCooldown': 12.5, 'AbilityUnitTargetLimit': 1, 'ChannelMoveSpeed': 40, 'DPS': 80, 'Description': 'Stuns an enemy trooper or NPC, damaging them while held. A successful kill provides a fire rate bonus, and restores a Bio Blast charge.  This bonus stacks independently', 'FireRateBuffDuration': 40, 'Name': 'Consume', 'SalvageBonus_FireRate': 25, 'SalvageDuration': 3, 'TickInterval': 0.25}, '3': {'AbilityCastDelay': 0.25, 'AbilityCastRange': '15m', 'AbilityCharges': 2, 'AbilityCooldown': 64, 'AbilityCooldownBetweenCharge': 3, 'AbilityUnitTargetLimit': 1, 'BlastRadius': '5m', 'ChannelMoveSpeed': 50, 'Description': 'Shoots out a blast of consumed remains, damaging and slowing enemies. Multiple hits increase the slow.', 'EnemyMoveSlow': 10, 'EnemyMoveSlowDuration': 5, 'Name': 'Bio Blast', 'ScrapDamage': 75}, '4': {'AbilityCastDelay': 1.5, 'AbilityChannelTime': 8, 'AbilityCooldown': 138, 'AbilityUnitTargetLimit': 1, 'DamagePerSecondFlown': 16, 'Description': 'Launch a flying shadow copy of yourself that you control, teleporting your original body to wherever it lands. The teleport explosion slows enemies and deals damage based on how long you were flying.', 'EnemyMoveSlowDuration': 1, 'EnemySlowPct': 60, 'ExplosionRadius': '8m', 'Name': 'Astral Walk'}}",25.0,0.8,0,635,10,0.0,4.75,71.4,0.5,58,0.1,22,1,116,"{'BulletDamage': 1.58, 'MeleeDamage': 3.4, 'Health': 41.0, 'TechDamagePerc': 0.0, 'BulletResist': 0.0}",63,550,7.0,4,Wrecker,1,0.0,1,False,1,2.75,2.86,{},0,3,5,0.2,0,0,0,1,,
