,AbilityResourceMax,AbilityResourceRegenPerSecond,BaseHealthRegen,BoundAbilities,BulletDamage,BulletGravityScale,BulletRadius,BulletSpeed,ClipSize,CritDamageReceivedScale,CrouchSpeed,DPS,FalloffBias,FalloffEndRange,FalloffEndScale,FalloffStartRange,FalloffStartScale,HeavyMeleeDamage,LevelScaling,LightMeleeDamage,MaxHealth,MaxMoveSpeed,MoveAcceleration,Name,ProcBuildUpRateScale,ReloadDelay,ReloadMovespeed,ReloadSingle,ReloadSpeed,ReloadTime,RoundsPerSecond,SpiritScaling,SprintSpeed,Stamina,StaminaCooldown,StaminaRegenPerSecond,TechDuration,TechRange,WeaponPower,WeaponPowerScale,BulletArmorDamageReduction,TechArmorDamageReduction
hero_haze,0,0,2.0,"{'1': {'AbilityCastDelay': 0.2, 'AbilityCooldown': 26, 'AbilityUnitTargetLimit': 1, 'AoESleep': '0m', 'BombFallHeight': '1.5m', 'ChannelMoveSpeed': 50, 'Damage': 70, 'Description': ""Throw a dagger that damages and sleeps the target. Sleeping targets wake up shortly after being damaged. Throwing a Dagger does not break your invisibility. Sleep Dagger does not interrupt enemies' channeling abilities."", 'DoesNotBreakInvis': 1, 'DrowsyDuration': 0.35000000000000003, 'DrowsyMoveSlowPercent': 60, 'MinimumSleepTime': 0.2, 'Name': 'Sleep Dagger', 'RicochetRadius': '20m', 'SleepDuration': 3, 'SleepWakeUpDelay': 0.1, 'TickRate': 0.5}, '2': {'AbilityCooldown': 37, 'AbilityDuration': 8, 'AbilityUnitTargetLimit': 1, 'ChannelMoveSpeed': 50, 'Description': 'Fade out of sight, becoming invisible and gaining sprint speed. Attacking removes invisibility. Close enemies can see through your invisibility.', 'FullInvisDistance': '50m', 'InvisAlertWhenFading': 1, 'InvisFadeToDuration': 1.5, 'InvisMoveSpeedMod': '2.0m', 'Name': 'Smoke Bomb', 'RevealOnDamageDuration': 1.5, 'RevealOnSpottedDuration': 0.5, 'SpottedRadius': '18m'}, '3': {'AbilityDuration': 6, 'AbilityUnitTargetLimit': 1, 'BossDamagePct': 30, 'ChannelMoveSpeed': 50, 'DamageBonusFixedPerStack': 0.2, 'Description': 'Shooting a target increases your bullet damage on that target. Gain one stack per bullet hit, two if the hit is a headshot.', 'MaxStacks': 30, 'Name': 'Fixation'}, '4': {'AbilityCastDelay': 0.4, 'AbilityChannelTime': 3, 'AbilityCooldown': 138, 'AbilityUnitTargetLimit': 1, 'BonusFireRate': 25, 'ChannelMoveSpeed': '4m', 'Description': 'Enter a flurry, firing your weapon at nearby enemies with perfect accuracy.  During the flurry,  gains a fire rate bonus and will evade some of the bullets shot at her.', 'EvasionPercent': 50, 'Name': 'Bullet Dance', 'Radius': '15m', 'TargetsPerTick': 1, 'WeaponDamageBonus': 2}}",5.6,1.5,0,762,25,0.0,4.75,56.0,0.5,46,0.1,22,1,116,"{'BulletDamage': 0.28500000000000003, 'MeleeDamage': 3.4, 'Health': 27.0, 'TechDamagePerc': 0.0, 'BulletResist': 0.0}",63,500,8.0,4,Haze,1,0.0,1,False,1,2.35,10.0,{'ClipSize': 0.5},0,3,5,0.2,0,0,0,1,,
hero_hornet,0,0,2.0,"{'1': {'AbilityCastDelay': 0.2, 'AbilityCooldown': 42, 'AbilityUnitTargetLimit': 1, 'CaptureRadius': '8m', 'ChainDuration': 2, 'ChainLength': '6m', 'ChannelMoveSpeed': 50, 'Damage': 60, 'Description': 'Throw a stake that tethers enemies to the location where the stake lands. Enemy movement is restricted to the length of the tether.', 'EnemyDragSpeed': 1000, 'Name': 'Stake', 'SlowPercent': 30}, '2': {'AbilityChannelTime': 0.2, 'AbilityCooldown': 42, 'AbilityDuration': 8, 'AbilityUnitTargetLimit': 1, 'AirSideMoveSpeedPercentage': -35, 'AirSpeedBonus': '0m', 'Description': 'Leap into the air and fly. While in flight your weapon deals bonus spirit damage.', 'JumpVelocity': 1000, 'MagicDamagePerBullet': 10, 'MaxFlyHeight': 1720, 'MinVelocityZ': -20, 'Name': 'Flight', 'WeaponRecoilReduction': 40}, '3': {'AbilityCastDelay': 0.2, 'AbilityCooldown': 26, 'AbilityUnitTargetLimit': 1, 'BulletResistReduction': -6, 'ChannelMoveSpeed': 50, 'DebuffDuration': 6, 'Description': ""Your crow familiar deals impact damage, reduces their bullet resist and applies a bleed that deals damage based on the target's current health."", 'DotHealthPercent': 3, 'ImpactDamage': 40, 'Name': 'Crow Familiar', 'TargetBounceRange': '0m', 'TickRate': 0.5, 'VisualSplashRadius': '1m'}, '4': {'AbilityCharges': 2, 'AbilityCooldown': 53, 'AbilityCooldownBetweenCharge': 1.6, 'AbilityUnitTargetLimit': 1, 'BonusGoldOnKill': 250, 'ChannelMoveSpeed': 50, 'Damage': 160, 'Description': 'Use your scoped rifle to fire a powerful shot over long distances. Deal only partial damage until fully charged after 1s of being scoped. Does bonus damage to enemies with less than 50% health remaining. Landing a killing blow on a player with Assassinate grants you bonus souls.', 'HeadshotBonus': 20, 'LowHealthEnemyDamageBonus': 145, 'LowHealthEnemyThresholdPct': 50, 'MaxSoundDistance': 2000, 'MoveSpeed': '4m', 'Name': 'Assassinate', 'Range': '1000m', 'ShotRadius': 3, 'SnipeFOV': 18, 'SnipeZoomDuration': 0.15, 'ViewPunch': 2.5, 'WeaponDamageBonus': 13}}",13.0,0.8,0,889,22,0.0,4.75,68.4,0.5,58,0.1,22,1,116,"{'BulletDamage': 1.0, 'MeleeDamage': 3.4, 'Health': 20.0, 'TechDamagePerc': 0.0, 'BulletResist': 0.0}",63,550,8.0,4,Vindicta,1,0.0,1,False,1,2.91,5.26,{},0,2,5,0.2,0,0,0,1,-10.0,
hero_inferno,0,0,2.0,"{'1': {'AbilityCastDelay': 0.1, 'AbilityCastRange': '20m', 'AbilityCharges': 1, 'AbilityCooldown': 25, 'AbilityCooldownBetweenCharge': 6, 'AbilityUnitTargetLimit': 1, 'ChannelMoveSpeed': '18m', 'Damage': 50, 'DamageAmplification': 25, 'DebuffDuration': 8, 'Description': 'Spew napalm that slows enemy movement and amplifies the damage  does to them.', 'FlameHeightOffGround': 50, 'GrowthPerMeter': '0.5m', 'InitialWidth': '1m', 'Name': 'Catalyst', 'ParticleRadiusMultiplier': 1.15, 'SlowDuration': 4, 'SlowPercent': 40, 'TickRate': 0.5}, '2': {'AbilityCastDelay': 0.2, 'AbilityCooldown': 40, 'AbilityUnitTargetLimit': 1, 'AuraLingerDuration': 1, 'ChannelMoveSpeed': '18m', 'DashAirSpeed': '8m', 'DashSpeed': '12m', 'DashTime': 3, 'Description': 'Move forward at high speed and leave a flame trail that burns enemies. Infernus gains 50% slow resistance for the duration.  <br>Hold [] to dash faster.', 'FlameAuraDPS': 40, 'FlameAuraRadius': '4.5m', 'FlameDashJumpBonus': 50, 'GroundAuraSpacing': '1m', 'GroundFlameDuration': 4, 'Name': 'Flame Dash', 'SideMoveSpeedReduction': -65, 'SlowResistancePercent': 50, 'SpeedBurstSpeed': '20m', 'TickRate': 0.5}, '3': {'AbilityUnitTargetLimit': 1, 'BuildUpBulletPercentPerHit': 10, 'BuildUpDuration': 15, 'BurnDuration': 3, 'ChannelMoveSpeed': 50, 'CritBuildup': 16, 'DPS': 15, 'Description': ""Your bullets build up to apply a burning effect on enemies. 's bullets and abilities will refresh the duration."", 'Name': 'Afterburn', 'TickRate': 0.5}, '4': {'AbilityCooldown': 127, 'AbilityUnitTargetLimit': 1, 'ChannelMoveSpeed': 50, 'Damage': 160, 'Description': 'Turns you into a living bomb that explodes after a short delay, stunning all enemies in its radius.', 'ExplodeDelay': 3, 'Name': 'Concussive Combustion', 'Radius': '12m', 'StunDuration': 1.25}}",6.6,0.8,0,660,27,0.0,4.75,66.0,0.5,58,0.1,22,1,116,"{'BulletDamage': 0.36, 'MeleeDamage': 3.4, 'Health': 33.0, 'TechDamagePerc': 0.0, 'BulletResist': 0.0}",63,600,6.5,4,Infernus,1,0.0,1,False,1,2.49,10.0,{},0,3,5,0.2,0,0,0,1,,
hero_kali,0,0,2.0,"{'1': {'AbilityCastDelay': 0.25, 'AbilityCastRange': '50m', 'AbilityCharges': 2, 'AbilityCooldown': 30, 'AbilityCooldownBetweenCharge': 6, 'AbilityUnitTargetLimit': 1, 'BossDamagePercent': 50, 'ChannelMoveSpeed': 50, 'Damage': 120, 'Description': 'Throw a spinning blade that deals damage and returns to you.', 'MinReflectionDOTResult': 0.9500000000000001, 'MinReflectionZ': 0.30000000000000004, 'Name': 'Occilioblade', 'NoClipDuration': 1, 'ProjectileFlyOutTime': 0.6000000000000001, 'ProjectileFlyReturnTime': 1, 'ReflectionSpeedFactor': 0.5, 'ReturnOffSetTargetDistance': 150, 'ReturnUpVelocity': 200, 'TechCleaveExpireTime': 0.2}, '2': {'AbilityCooldown': 21, 'AbilityDuration': 4, 'AbilityUnitTargetLimit': 1, 'ChannelMoveSpeed': 50, 'Description': 'Provides a large speed bonus to you and nearby allies. The speed bonus decays over time.', 'MoveSpeedBonusPercentStart': 120, 'Name': 'Pack Hunter', 'Radius': '10m'}, '3': {'AbilityCastDelay': 0.2, 'AbilityCooldown': 25, 'AbilityDuration': 5, 'AbilityUnitTargetLimit': 1, 'ChannelMoveSpeed': 50, 'ClimbHeight': '1m', 'CloseRangeSpeed': 80, 'DamagePerSecond': 50, 'DebuffDuration': 3, 'Description': 'Send out a tornado that damages enemies it touches, as well as applying a lingering movement and fire rate slow.', 'DistanceAboveGround': '2m', 'DropDownRate': 2, 'FireRateSlow': 20, 'GroundDashReductionPercent': -30, 'Name': 'Dust Storm', 'OpenHeight': '2m', 'Radius': '3.5m', 'SlowPercent': 20, 'ThrownObjectRadius': 20, 'TickRate': 0.25, 'TornadoSpeed': 600, 'TrackingDistance': '15m'}, '4': {'AbilityCastDelay': 0.2, 'AbilityCastRange': '25m', 'AbilityCooldown': 127, 'AbilityUnitTargetLimit': 1, 'BoloBounceCount': 6, 'BoloBounceSpeed': 800, 'BoloContractRadius': '5m', 'BoloHitDamage': 25, 'BoloProcDamage': 75, 'BoloRadius': '0.8m', 'ChannelMoveSpeed': 50, 'DebuffDelay': 2, 'Description': 'Throw a bolo that bounces between enemy heroes before returning to you. Victims will slow down over 2s and then become immobilized for 2.0s. Bounces once per hero.', 'ImmobilizeDuration': 2, 'MaxGroundDashReduction': -50, 'MaxSlow': 100, 'Name': ""Trapper's Delight""}}",13.0,0.6000000000000001,0,508,16,0.0,4.75,108.0,0.5,58,0.1,22,1,116,"{'BulletDamage': 0.0, 'MeleeDamage': 3.4, 'Health': 41.0, 'TechDamagePerc': 0.0, 'BulletResist': 0.0}",63,550,7.0,4,Kali,1,0.0,1,False,1,2.6,8.33,{},0,3,5,0.2,0,0,0,1,,
hero_kelvin,0,0,2.0,"{'1': {'AbilityCastDelay': 0.1, 'AbilityCharges': 1, 'AbilityCooldown': 22, 'AbilityCooldownBetweenCharge': 7, 'AbilityUnitTargetLimit': 1, 'ChannelMoveSpeed': 50, 'Damage': 80, 'Description': 'Throw a grenade that explodes in a cloud of freezing ice, damaging and slowing enemies.', 'Name': 'Frost Grenade', 'Radius': '6.5m', 'SlowDuration': 4, 'SlowPercent': 40}, '2': {'AbilityCastDelay': 0.2, 'AbilityCooldown': 38, 'AbilityDuration': 8, 'AbilityUnitTargetLimit': 1, 'CameraDistance': 250, 'ChannelMoveSpeed': -1, 'Description': ' creates a floating trail of ice and snow that gives movement bonuses to him and his allies. Kelvin gains 60% slow resistance for the duration. Enemies can also walk on the floating trail. <br>Press [] / [] to travel up or down while in Ice Path.', 'IcePathAuraDuration': 18, 'IcePathEdgeWidth': '0.7m', 'IcePathInterval': 0.5, 'IcePathPullInStrength': 20, 'IcePathShardRadius': '1.2m', 'MinHeight': 20, 'ModifierRadius': '5m', 'MoveSpeedBonus': '2m', 'MoveWhileShootingSpeedPenaltyReductionPercent': 100, 'MoveWhileZoomedSpeedPenaltyReductionPercent': 100, 'Name': 'Ice Path', 'PopupForce': 30, 'SlowResistancePercent': 60, 'SprintSpeedBonus': '2m'}, '3': {'AbilityChannelTime': 5, 'AbilityCooldown': 24, 'AbilityUnitTargetLimit': 1, 'BeamSplit': '0m', 'CameraDistance': 250, 'ChannelMoveSpeed': -1, 'ChannelSlowPercent': 8, 'DPS': 60, 'Description': 'Shoot freezing cold energy out in front of you, damaging targets and building up movement and fire rate slow against them the longer you sustain the beam on them. You have reduced movement speed while using Arctic Beam. The beam may also claim Souls.', 'IceBeamBuildupProcDuration': 2, 'MaxFireRateSlowPercent': 40, 'MaxSlowPercent': 70, 'MaxSlowTime': 2, 'MinSlowPercent': 30, 'Name': 'Arctic Beam', 'PathLength': '25m', 'PathWidth': '1.1m', 'SlowDuration': 0.6000000000000001, 'TickRate': 0.1}, '4': {'AbilityCastDelay': 0.2, 'AbilityCooldown': 127, 'AbilityDuration': 5.5, 'AbilityUnitTargetLimit': 1, 'BlockerScaleFactor': 115, 'BonusHealthRegen': 120, 'ChannelMoveSpeed': 50, 'Description': ' freezes the air around him, creating an impenetrable dome around himself. While in the dome, allies rapidly regenerate health and enemies are slowed.', 'EnemyDragSpeed': 1000, 'GrowTime': 0.2, 'Name': 'Frozen Shelter', 'Radius': '10m', 'SlowPercent': 35}}",20.9,0.30000000000000004,0,254,15,0.0,4.75,83.6,0.5,58,0.1,22,1,116,"{'BulletDamage': 1.2, 'MeleeDamage': 3.4, 'Health': 50.0, 'TechDamagePerc': 0.0, 'BulletResist': 0.0}",63,600,6.5,4,Kelvin,1,0.0,1,False,1,2.58,4.0,{},0,3,5,0.2,0,0,0,1,,10.0
hero_krill,0,0,3.0,"{'1': {'AbilityCastDelay': 0.2, 'AbilityCooldown': 12.5, 'AbilityUnitTargetLimit': 1, 'ChannelMoveSpeed': 50, 'Damage': 60, 'DamageHealMult': 2, 'DamageHealMultNonHero': 0.7000000000000001, 'Description': 'Deal damage to nearby enemies and heal yourself based on the damage done. Heal is stronger against enemy heroes.', 'Name': 'Scorn', 'Radius': '10m', 'TickRate': 0.1}, '2': {'AbilityCastDelay': 1, 'AbilityChannelTime': 5, 'AbilityCooldown': 37, 'AbilityUnitTargetLimit': 1, 'BonusMoveSpeed': '3m', 'BulletResist': 80, 'ChannelMoveSpeed': -1, 'DPS': 80, 'Description': 'Burrow underground, moving faster, and gaining spirit and bullet armor. Damage from enemy heroes will reduce the speed bonus. When you jump out, knock enemies into the air and perform a spin attack that damages and slows. Cooldown starts when Burrow ends.', 'EnemyDamageSpeedPenalty': 0.5, 'Name': 'Burrow', 'Radius': '5m', 'SpeedLostDuration': 1, 'SpinDuration': 1.5, 'SpinSlowDuration': 0.30000000000000004, 'SpinSlowPercent': 10, 'TechResist': 30, 'TickRate': 0.1, 'UpForce': 250}, '3': {'AbilityCastDelay': 0.15, 'AbilityCastRange': '30m', 'AbilityCooldown': 42, 'AbilityDuration': 3.5, 'AbilityUnitTargetLimit': 1, 'ChannelMoveSpeed': 50, 'Damage': 40, 'Description': 'Spray sand that disarms enemies in front of you and deals damage.', 'GrowthPerMeter': '0.5m', 'InitialWidth': '5m', 'Name': 'Sand Blast'}, '4': {'AbilityCastRange': '5m', 'AbilityChannelTime': 2.75, 'AbilityCooldown': 95, 'AbilityUnitTargetLimit': 1, 'BonusHealthOnKill': 30, 'DPS': 60, 'Description': 'Hold the target in place, stunning them and dealing damage during the channel. If they die during Combo, you permanently gain max health.', 'Name': 'Combo'}}",3.6,0.8,0,320,20,0.0,4.75,20.0,0.5,58,0.1,22,1,116,"{'BulletDamage': 0.25, 'MeleeDamage': 3.4, 'Health': 44.0, 'TechDamagePerc': 0.0, 'BulletResist': 0.0}",63,700,7.8,4,Mo & Krill,1,0.0,1,False,1,2.8200000000000003,5.5600000000000005,{},0,3,5,0.2,0,0,0,1,,
hero_lash,0,0,2.0,"{'1': {'AbilityCastDelay': 0.15, 'AbilityCooldown': 19, 'AbilityPostCastDuration': 0.4, 'AbilityUnitTargetLimit': 1, 'ChannelMoveSpeed': 50, 'Description': 'Stomp the ground beneath you, damaging enemies in front of you. If you perform Ground Strike while airborne, you quickly dive towards the ground. Damage grows slower after 25m.', 'MinAimAngle': 60, 'Name': 'Ground Strike', 'Radius': '11m', 'StompDamage': 90, 'StompDamagePerMeterPrimary': 6, 'StompDamagePerMeterSecondary': 4.5, 'StompDamagePrimaryRange': '25m', 'StompVerticalThreshold': 130, 'StrikeVelocity': '50m'}, '2': {'AbilityCastRange': '30m', 'AbilityCharges': 1, 'AbilityCooldown': 42, 'AbilityCooldownBetweenCharge': 2, 'AbilityUnitTargetLimit': 1, 'ChannelMoveSpeed': 50, 'Description': 'Pull yourself through the air toward a target. Using Grapple also resets your limit of air jumps and dashes.', 'JumpSlowResistance': 0.667, 'JumpVelocity': '20m', 'LashFriendlies': 1, 'MinDistance': '0m', 'Name': 'Grapple'}, '3': {'AbilityCastDelay': 0.15, 'AbilityCastRange': '25m', 'AbilityCooldown': 26, 'AbilityUnitTargetLimit': 30, 'ChannelMoveSpeed': 50, 'Damage': 65, 'Description': 'Strike enemies with your whip, stealing life from them.', 'HealPctVsHeroes': 80, 'HealPctVsNonHeroes': 30, 'Name': 'Flog', 'TargetingConeAngle': 30}, '4': {'AbilityCastDelay': 0.30000000000000004, 'AbilityCastRange': '18m', 'AbilityChannelTime': 2, 'AbilityCooldown': 138, 'AbilityUnitTargetLimit': 6, 'BoostTime': 1, 'ChannelMoveSpeed': 50, 'Description': 'Focus on enemies to connect whips to them. After channeling, connected enemies are lifted and stunned then slammed into the ground. Your victims and any enemies in the landing zone will be damaged and slowed. <br>Press [] to throw connected enemies early. Enemies that are not in line of sight or go out of range during the latch time will not be grabbed.', 'HangTime': 0.6000000000000001, 'ImpactDamage': 115, 'ImpactRadius': '5m', 'LiftHeight': '6m', 'LockonConeAngle': 40, 'LosingLockGraceTime': 0.4, 'MaxLockonStacks': 1, 'Name': 'Death Slam', 'NotInConeLosesLock': 1, 'SlamSpeed': 1600, 'SlowDuration': 4, 'SlowPercent': 50, 'ThrowDistance': '12m', 'ThrowStraightDuration': 1.5, 'TimeToGainLockonStack': 0.6000000000000001, 'TimeToLoseLockonStack': 2, 'UpBoostSpeed': 400}}",10.0,0.8,0,635,29,0.0,4.75,40.0,0.5,58,0.1,22,1,116,"{'BulletDamage': 0.9, 'MeleeDamage': 3.4, 'Health': 42.0, 'TechDamagePerc': 0.0, 'BulletResist': 0.0}",63,550,7.0,4,Lash,1,0.0,1,False,1,2.35,4.0,{},1,3,5,0.2,0,0,0,1,,15.0
hero_mirage,0,0,2.0,"{'1': {'AbilityCastDelay': 0.30000000000000004, 'AbilityCooldown': 32, 'AbilityDuration': 2, 'AbilityUnitTargetLimit': 1, 'BossDamagePercent': 50, 'ChannelMoveSpeed': '20m', 'ClimbHeight': '1m', 'Damage': 60, 'DampingFactor': 0.30000000000000004, 'Description': ""Send out a tornado that damages enemies and lifts them up in the air. While they're up in the air, targets will fully evade all bullets."", 'DistanceAboveGround': '2m', 'DropDownRate': 10, 'EnemyLiftDuration': 0.6000000000000001, 'ForwardOffset': 125, 'HoldInPlaceDuration': 1.25, 'LiftHeight': '3m', 'MaxDeltaMovementControl': '2m', 'Name': 'Tornado', 'OpenHeight': '8m', 'Radius': '3.5m', 'TargetBulletEvasionChance': 100, 'TickRate': 0.25, 'TornadoSpeed': 1200}, '2': {'AbilityCastDelay': 0.05, 'AbilityCharges': 3, 'AbilityChargesConditionally': 1, 'AbilityCooldownBetweenCharge': 0.05, 'AbilityUnitTargetLimit': 1, 'ChannelMoveSpeed': 50, 'DPS': 20, 'DamageInterval': 0.5, 'DebuffDuration': 4, 'Description': 'Start launching fire scarabs. Each scarab can be launched separately, applying a lifesteal over time to enemies they hit. Once the launch window ends, this ability goes on cooldown.', 'HealingFactor': 40, 'LaunchWindowCooldown': 35, 'LaunchWindowDuration': 20, 'Name': 'Fire Scarabs', 'NonHeroHealingFactor': 15, 'Radius': '4m'}, '3': {'AbilityCastDelay': 0, 'AbilityCooldown': 37, 'AbilityUnitTargetLimit': 1, 'ChannelMoveSpeed': 200, 'Description': 'You become enveloped in a whirlwind that provides bullet evasion and movement speed.', 'MaxStacks': 5, 'Name': 'Tempest Ward', 'ProcBonusMagicDamage': 20, 'ProcBonusMagicDamageEscalation': 15, 'ProcChance': 100, 'ProcCooldown': 2, 'Radius': '10m', 'VictimStackDuration': 8, 'WhirlwindDuration': 3.5, 'WhirlwindEvasionChance': 50}, '4': {'AbilityCastDelay': 0.5, 'AbilityCooldown': 74, 'AbilityUnitTargetLimit': 1, 'BombBonusDamagePerHero': 60, 'BossDamagePercent': 50, 'ChannelMoveSpeed': 50, 'Damage': 225, 'Description': 'Launch a slow projectile that you can activate anywhere along its path to detonate it, dealing damage to enemies caught in its radius. Deals bonus damage for each additional hero hit.', 'MaxProjectileLifetime': 8, 'Name': 'Djinn Bomb', 'Radius': '11m'}}",4.7,0.8,0,320,14,0.0,4.75,17.4,0.5,58,0.1,22,1,116,"{'BulletDamage': 0.4, 'MeleeDamage': 3.4, 'Health': 41.0, 'TechDamagePerc': 0.0, 'BulletResist': 0.0}",63,550,7.0,4,Mirage,1,0.0,1,False,1,2.35,3.7,{},0,3,5,0.2,0,0,0,1,,
hero_nano,0,0,2.0,"{'1': {'AbilityCastDelay': 0.2, 'AbilityCooldown': 26, 'AbilityUnitTargetLimit': 1, 'CatAboveGround': '0.1m', 'CatAccel': '15m', 'CatClimbHeight': '3m', 'CatDropDownRate': 5, 'CatLifetime': 2.5, 'CatMaxSpeed': '25m', 'CatStartSpeed': '5m', 'ChannelMoveSpeed': 50, 'ChargeDragVerticalOffset': 30, 'ChargeRadius': 75, 'Description': ""Send a Spirit Cat forward that grab's targets in its way.  Grabbing a Hero will cause an explosion soon after. <br>Press [] to manually create the explosion."", 'ExplosionDamage': 100, 'ExplosionRadius': '8m', 'Name': ""Sekhmet's Spirit"", 'TossSpeed': 400}, '2': {'AbilityCastDelay': 0.2, 'AbilityCastRange': '14m', 'AbilityCharges': 1, 'AbilityCooldown': 32, 'AbilityCooldownBetweenCharge': 10, 'AbilityPostCastDuration': 0.25, 'AbilityUnitTargetLimit': 1, 'CameraDistance': 250, 'ChannelMoveSpeed': 50, 'Damage': 60, 'Description': 'Leap at a target to inflict Light Melee damage.  Targetting an enemy will cause slow on nearby enemies.  Targeting an ally will have reduced Cooldown and Recharge times.', 'ExplodeRadius': '4m', 'FriendlyRechargeTime': 3, 'FriendlyTargetCD': 16, 'JumpHeight': '3m', 'MinTimeToTarget': 0.5, 'MoveSpeedToTarget': '25m', 'Name': 'Pounce', 'SlashRange': '3m', 'SlowDuration': 2, 'SlowPercent': 30}, '3': {'AbilityCastDelay': 0.2, 'AbilityCooldown': 64, 'AbilityUnitTargetLimit': 1, 'ActiveRadius': '20m', 'CatActivateDuration': 1.5, 'ChannelMoveSpeed': 50, 'DPS': 30, 'DamageTick': 0.5, 'Description': 'Send out Ava to attack a nearby enemy.  Targetted enemies have reduced healing and give health to Ava and  when damanged by them.  Ava is only active when  is nearby. <br>While nearby Press [3] to recall Ava, Ava regains health while recalled.', 'HealAmpReceivePenaltyPercent': -20, 'HealAmpRegenPenaltyPercent': -20, 'InactiveRadius': '20m', 'Name': 'Perched Predator', 'RecallCooldown': 10.5, 'RecallRange': '5m', 'SelfHealScale': 0.5, 'StatueArmTime': 1, 'StatueHealth': 200, 'StatueHeldRegen': 40, 'StatueLifetime': 60, 'TargetLifesteal': 30, 'TargetLifestealNonHero': 10, 'TickInterval': 0.1}, '4': {'AbilityCastDelay': 0.2, 'AbilityCooldown': 95, 'AbilityDuration': 12, 'AbilityUnitTargetLimit': 1, 'BonusFireRate': 20, 'BulletArmorReductionDuration': 6, 'BulletArmorReductionHeavy': 15, 'BulletArmorReductionLight': 5, 'ChannelMoveSpeed': 50, 'Description': 'Cast yourself in shadow and go Invisible.  Attacks do not break invisibility but they will temporarily reveal you.  Hitting enemies with Melee damage will reduce their bullet resist (stacking)', 'InvisAlertWhenFading': 1, 'InvisMoveSpeedMod': '1m', 'MeleeAttackSpeedBonus': 40, 'Name': 'Queen of Shadows', 'RevealOnDamageDuration': 0.25, 'RevealOnSpottedDuration': 0.25, 'SpottedRadius': '15m'}}",3.0,0.8,0,318,16,0.0,4.75,12.0,0.5,58,0.1,22,1,116,"{'BulletDamage': 0.159, 'MeleeDamage': 3.4, 'Health': 41.0, 'TechDamagePerc': 0.0, 'BulletResist': 0.0}",63,550,7.0,4,Calico,1,0.0,1,False,1,3.5,4.0,{},0,3,5,0.2,0,0,0,1,,
hero_orion,0,0,2.0,"{'1': {'AbilityCastDelay': 0.5, 'AbilityChannelTime': 9999, 'AbilityCharges': 1, 'AbilityCooldown': 17, 'AbilityCooldownBetweenCharge': 4, 'AbilityUnitTargetLimit': 1, 'AirSpeedMax': 150, 'BossDamagePercent': 25, 'CameraHeightOffset': 20, 'CameraHorizontalOffset': 15, 'ChannelMoveSpeed': 50, 'Damage': 100, 'Description': 'Charge up a powerful shot that pierces through enemies. Hold [] or [] to hold the shot.', 'FallSpeedMax': 60, 'Name': 'Charged Shot', 'TechCleaveExpireTime': 0.2}, '2': {'AbilityCastDelay': 0.5, 'AbilityCooldown': 35, 'AbilityDuration': 7, 'AbilityUnitTargetLimit': 1, 'AirSpeedMax': 150, 'BulletSplitShot': 5, 'Description': 'Launches you high in the air, allowing you to glide slowly. While airborne, you gain Weapon Damage and multishot on your weapon. Press [] to cancel the glide.', 'FallSpeedMax': 30, 'FxRadius': '4m', 'JumpPitch': -60, 'JumpSpeed': '27.5m', 'Name': 'Rain of Arrows', 'WeaponDamageBonus': 4}, '3': {'AbilityCooldown': 37, 'AbilityUnitTargetLimit': 1, 'ArmTime': 2, 'ChannelMoveSpeed': 50, 'Damage': 30, 'Description': 'Throw out a trap that begins to arm itself. Once armed, the trap will trigger when an enemy enters its radius, immobilizing and then slowing them.', 'ImmobilizeDuration': 1.25, 'Lifetime': 20, 'Name': 'Immobilizing Trap', 'Radius': '6m', 'SlowDuration': 1, 'SlowPercent': 50, 'TrapHeight': '2m', 'TripGravity': 0.4, 'TripTime': 0.5, 'TripUpSpeed': 250}, '4': {'AbilityCastDelay': 1.5, 'AbilityChannelTime': 14, 'AbilityCooldown': 127, 'AbilityUnitTargetLimit': 1, 'BonusTechPowerPerKill': 5, 'Damage': 250, 'Description': 'After 1.5s cast time, launch a spirit owl that you control and which explodes on impact, damaging and stunning enemies. Hold [] to accelerate the owl.<br>Press [] to release control. Gain permanent Spirit Power for each enemy hero killed with Guided Owl.', 'ExplosionRadius': '12m', 'Name': 'Guided Owl', 'StunDuration': 0.75}}",22.0,0.8,0,495,17,0.0,4.75,55.0,0.5,58,0.1,22,1,116,"{'BulletDamage': 1.8, 'MeleeDamage': 3.4, 'Health': 27.0, 'TechDamagePerc': 0.0, 'BulletResist': 0.0}",63,550,6.0,4,Grey Talon,1,0.0,1,False,1,2.35,2.5,"{'MaxMoveSpeed': 0.04, 'RoundsPerSecond': 0.00625, 'FireRate': 0.25}",0,3,5,0.2,0,0,0,1,,
